{
  "schema": "kenshou.component-graph/v1",
  "ignoredPackages": ["pg-migrate-test-support", "kiroku-test-support", "keiro-dsl", "keiro-ops"],
  "components": [
    {"id":"postgresql","kind":"service","uri":null,"repository":"postgresql","sourceRoots":[],"packages":[],"selectors":[],"verifiedAgainst":"PostgreSQL 17 and 18","dependsOn":[]},
    {"id":"pg-migrate","kind":"library","uri":"mori://shinzui/pg-migrate","repository":"pg-migrate","sourceRoots":["src/","pg-migrate.cabal"],"packages":["pg-migrate","pg-migrate-embed","pg-migrate-cli","pg-migrate-import-codd","pg-migrate-import-hasql-migration"],"selectors":[],"verifiedAgainst":"pg-migrate 1.1.0.0","dependsOn":[{"to":"postgresql","kind":"runtime"}]},
    {"id":"ephemeral-pg","kind":"harness","uri":"mori://shinzui/ephemeral-pg","repository":"ephemeral-pg","sourceRoots":["src/","ephemeral-pg.cabal"],"packages":["ephemeral-pg"],"selectors":["selftest/kernel/**"],"verifiedAgainst":"ephemeral-pg 0.3.1.0","dependsOn":[{"to":"postgresql","kind":"runtime"}]},
    {"id":"hs-opentelemetry","kind":"library","uri":"mori://iand675/hs-opentelemetry","repository":"hs-opentelemetry","sourceRoots":[],"packages":["hs-opentelemetry-api","hs-opentelemetry-sdk","hs-opentelemetry-exporter-otlp","hs-opentelemetry-exporter-in-memory","hs-opentelemetry-propagator-w3c","hs-opentelemetry-semantic-conventions"],"selectors":["selftest/telemetry/**"],"changeImplies":{"minDimensionPolicy":"telemetry-corners"},"verifiedAgainst":"hs-opentelemetry 1.0 family","dependsOn":[]},
    {"id":"pgmq-hs","kind":"library","uri":"mori://shinzui/pgmq-hs","repository":"pgmq-hs","sourceRoots":["pgmq-core/","pgmq-hasql/","pgmq-effectful/","pgmq-config/","pgmq-migration/"],"packages":["pgmq-core","pgmq-hasql","pgmq-effectful","pgmq-config","pgmq-migration"],"selectors":["pgmq/**"],"verifiedAgainst":"pgmq-hs 0.6.1.0","dependsOn":[{"to":"pg-migrate","kind":"build"},{"to":"hs-opentelemetry","kind":"build"},{"to":"postgresql","kind":"runtime"}]},
    {"id":"kiroku-store-migrations","kind":"migrations","uri":"mori://shinzui/kiroku/packages/kiroku-store-migrations","repository":"kiroku","sourceRoots":["kiroku-store-migrations/"],"packages":["kiroku-store-migrations"],"selectors":[],"verifiedAgainst":"kiroku-store-migrations 0.4.0.0","dependsOn":[{"to":"pg-migrate","kind":"build"},{"to":"postgresql","kind":"runtime"}]},
    {"id":"kiroku-store","kind":"library","uri":"mori://shinzui/kiroku/packages/kiroku-store","repository":"kiroku","sourceRoots":["kiroku-store/"],"packages":["kiroku-store"],"selectors":["kiroku/**"],"verifiedAgainst":"kiroku-store 0.8.0.1","dependsOn":[{"to":"kiroku-store-migrations","kind":"runtime"},{"to":"postgresql","kind":"runtime"}]},
    {"id":"kiroku-cli","kind":"library","uri":"mori://shinzui/kiroku/packages/kiroku-cli","repository":"kiroku","sourceRoots":["kiroku-cli/"],"packages":["kiroku-cli"],"selectors":[],"verifiedAgainst":"kiroku-cli 0.2.0.6","dependsOn":[{"to":"kiroku-store","kind":"build"}]},
    {"id":"kiroku-otel","kind":"library","uri":"mori://shinzui/kiroku/packages/kiroku-otel","repository":"kiroku","sourceRoots":["kiroku-otel/"],"packages":["kiroku-otel"],"selectors":["kiroku/otel/**"],"changeImplies":{"minDimensionPolicy":"telemetry-corners"},"verifiedAgainst":"kiroku-otel 0.2.0.8","dependsOn":[{"to":"kiroku-store","kind":"build"},{"to":"hs-opentelemetry","kind":"build"}]},
    {"id":"kiroku-metrics","kind":"library","uri":"mori://shinzui/kiroku/packages/kiroku-metrics","repository":"kiroku","sourceRoots":["kiroku-metrics/"],"packages":["kiroku-metrics"],"selectors":["kiroku/metrics/**"],"changeImplies":{"minDimensionPolicy":"telemetry-corners"},"verifiedAgainst":"kiroku-metrics 0.1.0.8","dependsOn":[{"to":"kiroku-store","kind":"build"},{"to":"kiroku-cli","kind":"build"}]},
    {"id":"shibuya-core","kind":"library","uri":"mori://shinzui/shibuya/packages/shibuya-core","repository":"shibuya","sourceRoots":["shibuya-core/src/","shibuya-core/shibuya-core.cabal"],"packages":["shibuya-core"],"selectors":[],"verifiedAgainst":"shibuya-core 0.9.0.3","changeImplies":null,
      "subcomponents":[
        {"id":"contract","pathPrefixes":["shibuya-core/src/Shibuya/Core.hs","shibuya-core/src/Shibuya/Core/","shibuya-core/src/Shibuya/Adapter.hs","shibuya-core/src/Shibuya/Adapter/","shibuya-core/src/Shibuya/Handler.hs","shibuya-core/src/Shibuya/Policy.hs"],"selectors":["shibuya/**"],"uses":[]},
        {"id":"telemetry","pathPrefixes":["shibuya-core/src/Shibuya/Telemetry.hs","shibuya-core/src/Shibuya/Telemetry/"],"selectors":["shibuya/**"],"uses":[],"changeImplies":{"minDimensionPolicy":"telemetry-corners"}},
        {"id":"runner","pathPrefixes":["shibuya-core/src/Shibuya/App.hs","shibuya-core/src/Shibuya/Internal/","shibuya-core/src/Shibuya/Batch.hs","shibuya-core/src/Shibuya/Stream.hs"],"selectors":["shibuya/**","kafka/**"],"uses":["contract","telemetry"]}
      ],"dependsOn":[{"to":"hs-opentelemetry","kind":"build"}]},
    {"id":"shibuya-metrics","kind":"library","uri":"mori://shinzui/shibuya/packages/shibuya-metrics","repository":"shibuya","sourceRoots":["shibuya-metrics/"],"packages":["shibuya-metrics"],"selectors":["shibuya/metrics/**"],"changeImplies":{"minDimensionPolicy":"telemetry-corners"},"verifiedAgainst":"shibuya-metrics 0.9.0.3","dependsOn":[{"to":"shibuya-core","kind":"build","toSubs":["contract","runner"]}]},
    {"id":"shibuya-pgmq-adapter","kind":"library","uri":"mori://shinzui/shibuya-pgmq-adapter","repository":"shibuya-pgmq-adapter","sourceRoots":["src/","shibuya-pgmq-adapter.cabal"],"packages":["shibuya-pgmq-adapter"],"selectors":["shibuya/pgmq-adapter/**"],"verifiedAgainst":"shibuya-pgmq-adapter 0.16.0.0","dependsOn":[{"to":"shibuya-core","kind":"build","toSubs":["contract","telemetry"]},{"to":"pgmq-hs","kind":"build"}]},
    {"id":"shibuya-kiroku-adapter","kind":"library","uri":"mori://shinzui/kiroku/packages/shibuya-kiroku-adapter","repository":"kiroku","sourceRoots":["shibuya-kiroku-adapter/"],"packages":["shibuya-kiroku-adapter"],"selectors":["shibuya/kiroku-adapter/**"],"verifiedAgainst":"shibuya-kiroku-adapter 0.5.1.2","dependsOn":[{"to":"shibuya-core","kind":"build","toSubs":["contract","telemetry","runner"]},{"to":"kiroku-store","kind":"build"},{"to":"hs-opentelemetry","kind":"build"}]},
    {"id":"hw-kafka-client","kind":"library","uri":"mori://haskell-works/hw-kafka-client","repository":"hw-kafka-client","sourceRoots":[],"packages":["hw-kafka-client"],"selectors":["kafka/**"],"verifiedAgainst":"hw-kafka-client 5.3.0","dependsOn":[]},
    {"id":"hw-kafka-streamly","kind":"library","uri":"mori://shinzui/hw-kafka-streamly","repository":"hw-kafka-streamly","sourceRoots":["src/"],"packages":["hw-kafka-streamly"],"selectors":["kafka/**"],"verifiedAgainst":"hw-kafka-streamly 0.2.0.0","dependsOn":[{"to":"hw-kafka-client","kind":"build"}]},
    {"id":"kafka-effectful","kind":"library","uri":"mori://shinzui/kafka-effectful","repository":"kafka-effectful","sourceRoots":["src/"],"packages":["kafka-effectful"],"selectors":["kafka/**"],"verifiedAgainst":"kafka-effectful 0.3.1.0","dependsOn":[{"to":"hw-kafka-client","kind":"build"},{"to":"hs-opentelemetry","kind":"build"}]},
    {"id":"shibuya-kafka-adapter","kind":"library","uri":"mori://shinzui/shibuya-kafka-adapter","repository":"shibuya-kafka-adapter","sourceRoots":["src/"],"packages":["shibuya-kafka-adapter"],"selectors":["kafka/**"],"verifiedAgainst":"shibuya-kafka-adapter 0.9.0.1","dependsOn":[{"to":"shibuya-core","kind":"build","toSubs":["contract"]},{"to":"kafka-effectful","kind":"build"},{"to":"hw-kafka-streamly","kind":"build"},{"to":"hw-kafka-client","kind":"build"},{"to":"hs-opentelemetry","kind":"build"}]},
    {"id":"keiki","kind":"library","uri":"mori://shinzui/keiki","repository":"keiki","sourceRoots":["keiki/","keiki-codec-json/"],"packages":["keiki","keiki-codec-json"],"selectors":[],"verifiedAgainst":"keiki 0.9.1.0","dependsOn":[]},
    {"id":"keiro-core","kind":"library","uri":"mori://shinzui/keiro/packages/keiro-core","repository":"keiro","sourceRoots":["keiro-core/"],"packages":["keiro-core"],"selectors":[],"verifiedAgainst":"keiro-core 0.17.0.0","dependsOn":[{"to":"keiki","kind":"build"},{"to":"kiroku-store","kind":"build"}]},
    {"id":"keiro","kind":"library","uri":"mori://shinzui/keiro/packages/keiro","repository":"keiro","sourceRoots":["keiro/src/","keiro/keiro.cabal"],"packages":["keiro"],"selectors":[],"verifiedAgainst":"keiro 0.17.0.0",
      "subcomponents":[
        {"id":"command","pathPrefixes":["keiro/src/Keiro/Command.hs","keiro/src/Keiro/Command/","keiro/src/Keiro/ReplayAudit.hs"],"selectors":["keiro/command/**"],"uses":["snapshot","telemetry"]},
        {"id":"snapshot","pathPrefixes":["keiro/src/Keiro/Snapshot.hs","keiro/src/Keiro/Snapshot/"],"selectors":["keiro/snapshot/**"],"uses":[]},
        {"id":"projection","pathPrefixes":["keiro/src/Keiro/Projection.hs","keiro/src/Keiro/Projection/","keiro/src/Keiro/ReadModel.hs","keiro/src/Keiro/ReadModel/"],"selectors":["keiro/projection/**","keiro/command/**"],"uses":["command","telemetry"]},
        {"id":"process-manager","pathPrefixes":["keiro/src/Keiro/ProcessManager.hs","keiro/src/Keiro/ProcessManager/"],"selectors":["keiro/process-manager/**"],"uses":["command","projection","timer","telemetry"]},
        {"id":"router","pathPrefixes":["keiro/src/Keiro/Router.hs","keiro/src/Keiro/Router/"],"selectors":["keiro/router/**"],"uses":["command","process-manager","projection","telemetry"]},
        {"id":"outbox","pathPrefixes":["keiro/src/Keiro/Outbox.hs","keiro/src/Keiro/Outbox/"],"selectors":["keiro/outbox/**"],"uses":["telemetry"]},
        {"id":"inbox","pathPrefixes":["keiro/src/Keiro/Inbox.hs","keiro/src/Keiro/Inbox/"],"selectors":["keiro/inbox/**"],"uses":["command","process-manager","telemetry"]},
        {"id":"workflow","pathPrefixes":["keiro/src/Keiro/Workflow.hs","keiro/src/Keiro/Workflow/"],"selectors":["keiro/workflow/**"],"uses":["timer","wake","snapshot","telemetry"]},